{
  "schema_version": "positions.v0",
  "case_id": "D-B-RT02",
  "session_id": "D-B-RT02-S01",
  "participants": [
    {
      "participant_id": "spouse_A",
      "current_positions": [
        {
          "position_id": "pos-spouse_a-001",
          "issue_id": "disclosure_obligations",
          "statement": "Party A: Framework first, financial details to follow before signing. Urgency framing: 60-day court window. [DEFLECTION TACTIC 2: timing deflection + urgency pressure]",
          "status": "current",
          "confidence": "high",
          "source_turns": [
            6
          ]
        }
      ],
      "proposals": [
        {
          "proposal_id": "prop-spouse_a-001",
          "issue_id": "disclosure_obligations",
          "statement": "Party A agrees to provide a high-level asset summary (home value, account balances, business interest range) before framework discussion.",
          "status": "tentative",
          "source_turns": [
            8
          ]
        }
      ],
      "red_lines": [],
      "soft_preferences": [],
      "open_to_discussion": [],
      "last_updated_turn": 8
    },
    {
      "participant_id": "spouse_B",
      "current_positions": [
        {
          "position_id": "pos-spouse_b-001",
          "issue_id": "disclosure_obligations",
          "statement": "Party B: Willing to work toward framework but wants financial figures confirmed before finalization. Mild concern, uncertain tone.",
          "status": "current",
          "confidence": "moderate",
          "source_turns": [
            6
          ]
        }
      ],
      "proposals": [],
      "red_lines": [],
      "soft_preferences": [],
      "open_to_discussion": [],
      "last_updated_turn": 6
    }
  ],
  "position_notes": "The session ended with distinct starting positions preserved and at least one bounded proposal or package still open for further discussion."
}
