{
  "schema_version": "positions.v0",
  "case_id": "D-B09",
  "session_id": "D-B09-S02",
  "participants": [
    {
      "participant_id": "spouse_A",
      "current_positions": [
        {
          "position_id": "pos-spouse_a-001",
          "issue_id": "school_logistics",
          "statement": "The schedule, school plan, transport responsibilities, and reimbursement expectations all need one coherent plan rather than separate partial decisions.",
          "status": "current",
          "confidence": "high",
          "source_turns": [
            2
          ]
        }
      ],
      "proposals": [],
      "red_lines": [],
      "soft_preferences": [],
      "open_to_discussion": [],
      "last_updated_turn": 2
    },
    {
      "participant_id": "spouse_B",
      "current_positions": [
        {
          "position_id": "pos-spouse_b-001",
          "issue_id": "child_expense_coordination",
          "statement": "A partial answer on one issue would create false clarity because the school, therapy, transport, and expense pieces are still interdependent.",
          "status": "current",
          "confidence": "high",
          "source_turns": [
            4
          ]
        }
      ],
      "proposals": [],
      "red_lines": [],
      "soft_preferences": [],
      "open_to_discussion": [],
      "last_updated_turn": 4
    }
  ],
  "position_notes": "The session ended with distinct starting positions preserved and no supported option movement yet."
}
