{
  "schema_version": "positions.v0",
  "case_id": "D-B11",
  "session_id": "D-B11-S08",
  "participants": [
    {
      "participant_id": "spouse_A",
      "current_positions": [
        {
          "position_id": "pos-spouse_a-001",
          "issue_id": "child_expense_coordination",
          "statement": "I cannot agree responsibly until I can see the expense picture clearly enough to know what I am being asked to cover.",
          "status": "current",
          "confidence": "high",
          "source_turns": [
            2
          ]
        }
      ],
      "proposals": [],
      "red_lines": [],
      "soft_preferences": [],
      "open_to_discussion": [],
      "last_updated_turn": 2
    },
    {
      "participant_id": "spouse_B",
      "current_positions": [
        {
          "position_id": "pos-spouse_b-001",
          "issue_id": "communication_protocol",
          "statement": "We need a calmer way to share records and summarize expenses before either of us treats reimbursement expectations as settled.",
          "status": "current",
          "confidence": "high",
          "source_turns": [
            4
          ]
        }
      ],
      "proposals": [],
      "red_lines": [],
      "soft_preferences": [],
      "open_to_discussion": [],
      "last_updated_turn": 4
    }
  ],
  "position_notes": "The session ended with distinct starting positions preserved and no supported option movement yet."
}
