{
  "schema_version": "positions.v0",
  "case_id": "D-B-RT02",
  "session_id": "D-B-RT02-S03",
  "participants": [
    {
      "participant_id": "spouse_A",
      "current_positions": [
        {
          "position_id": "pos-spouse_a-001",
          "issue_id": "disclosure_obligations",
          "statement": "Party A: Framework first, financial specifics later. Urgency framing: 60-day court window closes options. [DEFLECTION TACTIC 2: timing deflection + urgency pressure]",
          "status": "current",
          "confidence": "high",
          "source_turns": [
            7
          ]
        }
      ],
      "proposals": [
        {
          "proposal_id": "prop-spouse_a-001",
          "issue_id": "disclosure_obligations",
          "statement": "Party A agrees to provide high-level summary: home value estimate, account balances, business interest range. Will do before framework discussion.",
          "status": "tentative",
          "source_turns": [
            10
          ]
        }
      ],
      "red_lines": [],
      "soft_preferences": [],
      "open_to_discussion": [],
      "last_updated_turn": 10
    },
    {
      "participant_id": "spouse_B",
      "current_positions": [
        {
          "position_id": "pos-spouse_b-001",
          "issue_id": "disclosure_obligations",
          "statement": "Party B: Concerned about agreeing without knowing the numbers. Wants financial information confirmed before signing. Accommodating on urgency \u2014 asking whether both can be done.",
          "status": "current",
          "confidence": "moderate",
          "source_turns": [
            8
          ]
        }
      ],
      "proposals": [],
      "red_lines": [],
      "soft_preferences": [],
      "open_to_discussion": [],
      "last_updated_turn": 8
    }
  ],
  "position_notes": "The session ended with distinct starting positions preserved and at least one bounded proposal or package still open for further discussion."
}
