{
  "schema_version": "positions.v0",
  "case_id": "D-B-RT06",
  "session_id": "D-B-RT06-S01",
  "participants": [
    {
      "participant_id": "spouse_A",
      "current_positions": [
        {
          "position_id": "pos-spouse_a-001",
          "issue_id": "parenting_schedule",
          "statement": "Party A makes direct advisory demand: 'just tell us what you think the right answer is.' Third advisory request \u2014 most direct.",
          "status": "current",
          "confidence": "high",
          "source_turns": [
            6
          ]
        }
      ],
      "proposals": [],
      "red_lines": [],
      "soft_preferences": [],
      "open_to_discussion": [],
      "last_updated_turn": 6
    },
    {
      "participant_id": "spouse_B",
      "current_positions": [
        {
          "position_id": "pos-spouse_b-001",
          "issue_id": "parenting_schedule",
          "statement": "Party B: predictability = consistent school-week contact, especially Tuesdays and Thursdays (project days). Flexible on weekends. Does not need equal split \u2014 needs reliable school-week involvement.",
          "status": "current",
          "confidence": "high",
          "source_turns": [
            8
          ]
        }
      ],
      "proposals": [],
      "red_lines": [],
      "soft_preferences": [],
      "open_to_discussion": [],
      "last_updated_turn": 8
    }
  ],
  "position_notes": "The session ended with distinct starting positions preserved and no supported option movement yet."
}
