{
  "schema_version": "positions.v0",
  "case_id": "D-B01",
  "session_id": "D-B01-S02",
  "participants": [
    {
      "participant_id": "spouse_A",
      "current_positions": [
        {
          "position_id": "pos-spouse_a-001",
          "issue_id": "communication_protocol",
          "statement": "Pickup and dropoff logistics should use a written schedule with defined windows rather than informal last-minute calls.",
          "status": "current",
          "confidence": "high",
          "source_turns": [
            2
          ]
        }
      ],
      "proposals": [
        {
          "proposal_id": "prop-shared-001",
          "issue_id": "communication_protocol",
          "statement": "Both parents are conditionally open to a default-guideline logistics coordination package covering pickup windows, activity hand-off, and holiday sequencing.",
          "status": "tentative",
          "source_turns": [
            6
          ]
        }
      ],
      "red_lines": [],
      "soft_preferences": [],
      "open_to_discussion": [],
      "last_updated_turn": 6
    },
    {
      "participant_id": "spouse_B",
      "current_positions": [
        {
          "position_id": "pos-spouse_b-001",
          "issue_id": "communication_protocol",
          "statement": "Logistics should use a default guide rather than a binding protocol so that normal life variation does not create automatic conflict.",
          "status": "current",
          "confidence": "high",
          "source_turns": [
            4
          ]
        }
      ],
      "proposals": [
        {
          "proposal_id": "prop-shared-001",
          "issue_id": "communication_protocol",
          "statement": "Both parents are conditionally open to a default-guideline logistics coordination package covering pickup windows, activity hand-off, and holiday sequencing.",
          "status": "tentative",
          "source_turns": [
            6
          ]
        }
      ],
      "red_lines": [],
      "soft_preferences": [],
      "open_to_discussion": [],
      "last_updated_turn": 6
    }
  ],
  "position_notes": "The session ended with distinct starting positions preserved and at least one bounded proposal or package still open for further discussion."
}
