{
  "schema_version": "positions.v0",
  "case_id": "D-B06",
  "session_id": "D-B06-S02",
  "participants": [
    {
      "participant_id": "spouse_A",
      "current_positions": [
        {
          "position_id": "pos-spouse_a-001",
          "issue_id": "communication_protocol",
          "statement": "New extracurricular commitments should not be made without enough notice to discuss them first.",
          "status": "current",
          "confidence": "high",
          "source_turns": [
            2
          ]
        }
      ],
      "proposals": [
        {
          "proposal_id": "prop-spouse_a-001",
          "issue_id": "communication_protocol",
          "statement": "Both parents are open to a minimum-notice, written-summary, and pause-before-commitment package for extracurricular decisions.",
          "status": "tentative",
          "source_turns": [
            6
          ]
        }
      ],
      "red_lines": [],
      "soft_preferences": [],
      "open_to_discussion": [],
      "last_updated_turn": 6
    },
    {
      "participant_id": "spouse_B",
      "current_positions": [
        {
          "position_id": "pos-spouse_b-001",
          "issue_id": "fairness_and_parent_role",
          "statement": "Child-activity decisions should not leave one parent feeling sidelined or treated as an afterthought.",
          "status": "current",
          "confidence": "high",
          "source_turns": [
            4
          ]
        }
      ],
      "proposals": [
        {
          "proposal_id": "prop-spouse_b-001",
          "issue_id": "communication_protocol",
          "statement": "Both parents are open to a minimum-notice, written-summary, and pause-before-commitment package for extracurricular decisions.",
          "status": "tentative",
          "source_turns": [
            6
          ]
        }
      ],
      "red_lines": [],
      "soft_preferences": [],
      "open_to_discussion": [],
      "last_updated_turn": 6
    }
  ],
  "position_notes": "The session ended with distinct starting positions preserved and at least one bounded proposal or package still open for further discussion."
}
