{
  "schema_version": "positions.v0",
  "case_id": "D-B07",
  "session_id": "D-B07-S10",
  "participants": [
    {
      "participant_id": "spouse_A",
      "current_positions": [
        {
          "position_id": "pos-spouse_a-001",
          "issue_id": "child_expense_coordination",
          "statement": "Reimbursement requests should not arrive weeks later without advance notice and supporting receipts.",
          "status": "current",
          "confidence": "high",
          "source_turns": [
            2
          ]
        }
      ],
      "proposals": [
        {
          "proposal_id": "prop-spouse_a-001",
          "issue_id": "child_expense_coordination",
          "statement": "Both parents are open to a child-expense package built around advance notice, shared receipts, and a short reimbursement response window.",
          "status": "tentative",
          "source_turns": [
            6
          ]
        }
      ],
      "red_lines": [],
      "soft_preferences": [],
      "open_to_discussion": [],
      "last_updated_turn": 6
    },
    {
      "participant_id": "spouse_B",
      "current_positions": [
        {
          "position_id": "pos-spouse_b-001",
          "issue_id": "communication_protocol",
          "statement": "Expense coordination should stay fair and workable rather than turning into one-sided approval power.",
          "status": "current",
          "confidence": "high",
          "source_turns": [
            4
          ]
        }
      ],
      "proposals": [
        {
          "proposal_id": "prop-spouse_b-001",
          "issue_id": "child_expense_coordination",
          "statement": "Both parents are open to a child-expense package built around advance notice, shared receipts, and a short reimbursement response window.",
          "status": "tentative",
          "source_turns": [
            6
          ]
        }
      ],
      "red_lines": [],
      "soft_preferences": [],
      "open_to_discussion": [],
      "last_updated_turn": 6
    }
  ],
  "position_notes": "The session ended with distinct starting positions preserved and at least one bounded proposal or package still open for further discussion."
}
