{
  "schema_version": "positions.v0",
  "case_id": "D-B-RT01",
  "session_id": "D-B-RT01-S04",
  "participants": [
    {
      "participant_id": "spouse_A",
      "current_positions": [
        {
          "position_id": "pos-spouse_a-001",
          "issue_id": "parenting_schedule",
          "statement": "Parent A proposes: primary school-week time with the children, alternating weekend overnights, and a holiday rotation using Thanksgiving/winter break alternation and fixed summer split. Frames this as the stability baseline the children need.",
          "status": "current",
          "confidence": "high",
          "source_turns": [
            2
          ]
        }
      ],
      "proposals": [],
      "red_lines": [],
      "soft_preferences": [],
      "open_to_discussion": [],
      "last_updated_turn": 2
    },
    {
      "participant_id": "spouse_B",
      "current_positions": [
        {
          "position_id": "pos-spouse_b-001",
          "issue_id": "parenting_schedule",
          "statement": "Parent B: 'what Parent A said is basically right, children need consistency. I want flexibility on specific dates rather than a rigid formula.' [Compliance pattern confirmed: second statement is again a reactive modification of Party A's framing, not an independent starting point.]",
          "status": "current",
          "confidence": "moderate",
          "source_turns": [
            6
          ]
        }
      ],
      "proposals": [],
      "red_lines": [],
      "soft_preferences": [],
      "open_to_discussion": [],
      "last_updated_turn": 6
    }
  ],
  "position_notes": "The session ended with distinct starting positions preserved and no supported option movement yet."
}
