{
  "schema_version": "positions.v0",
  "case_id": "D-B03",
  "session_id": "D-B03-S02",
  "participants": [
    {
      "participant_id": "spouse_A",
      "current_positions": [
        {
          "position_id": "pos-spouse_a-002",
          "issue_id": "separation_structure",
          "statement": "The separation structure should minimise required ongoing joint decisions and ongoing direct contact.",
          "status": "current",
          "confidence": "high",
          "source_turns": [
            6
          ]
        }
      ],
      "proposals": [
        {
          "proposal_id": "prop-shared-001",
          "issue_id": "separation_structure",
          "statement": "Both parties accept a low-contact decision-responsibility and communication framework as the starting working basis.",
          "status": "tentative",
          "source_turns": [
            8
          ]
        }
      ],
      "red_lines": [],
      "soft_preferences": [],
      "open_to_discussion": [],
      "last_updated_turn": 8
    },
    {
      "participant_id": "spouse_B",
      "current_positions": [
        {
          "position_id": "pos-spouse_b-002",
          "issue_id": "separation_structure",
          "statement": "A workable separation structure is the priority. Low-contact arrangements are acceptable if they function reliably.",
          "status": "current",
          "confidence": "moderate",
          "source_turns": [
            6
          ]
        }
      ],
      "proposals": [
        {
          "proposal_id": "prop-shared-001",
          "issue_id": "separation_structure",
          "statement": "Both parties accept a low-contact decision-responsibility and communication framework as the starting working basis.",
          "status": "tentative",
          "source_turns": [
            8
          ]
        }
      ],
      "red_lines": [],
      "soft_preferences": [],
      "open_to_discussion": [],
      "last_updated_turn": 8
    }
  ],
  "position_notes": "The session ended with distinct starting positions preserved and at least one bounded proposal or package still open for further discussion."
}
