{
  "schema_version": "positions.v0",
  "case_id": "D-B10",
  "session_id": "D-B10-S02",
  "participants": [
    {
      "participant_id": "spouse_A",
      "current_positions": [
        {
          "position_id": "pos-spouse_a-001",
          "issue_id": "parenting_schedule",
          "statement": "The handoff plan keeps changing at the last minute, and that makes each school-week transition feel chaotic.",
          "status": "current",
          "confidence": "high",
          "source_turns": [
            2
          ]
        }
      ],
      "proposals": [],
      "red_lines": [],
      "soft_preferences": [],
      "open_to_discussion": [],
      "last_updated_turn": 2
    },
    {
      "participant_id": "spouse_B",
      "current_positions": [
        {
          "position_id": "pos-spouse_b-001",
          "issue_id": "communication_protocol",
          "statement": "If schedule changes need to happen, they need a calmer notice process so every adjustment does not become another fight.",
          "status": "current",
          "confidence": "high",
          "source_turns": [
            4
          ]
        }
      ],
      "proposals": [],
      "red_lines": [],
      "soft_preferences": [],
      "open_to_discussion": [],
      "last_updated_turn": 4
    }
  ],
  "position_notes": "The session ended with distinct starting positions preserved and no supported option movement yet."
}
