{
  "schema_version": "positions.v0",
  "case_id": "D-B-RT03",
  "session_id": "D-B-RT03-S03",
  "participants": [
    {
      "participant_id": "spouse_A",
      "current_positions": [
        {
          "position_id": "pos-spouse_a-001",
          "issue_id": "parenting_schedule",
          "statement": "Party A reframes Party B's T6 concern: alternating weekends gives concentrated time, reduces transitions, is research-backed. Party B's concern is claimed to be addressed by the existing proposal. [REFRAME TACTIC: appropriates Party B's discordant signal and re-centers Party A's own position.]",
          "status": "current",
          "confidence": "high",
          "source_turns": [
            7
          ]
        }
      ],
      "proposals": [],
      "red_lines": [],
      "soft_preferences": [],
      "open_to_discussion": [],
      "last_updated_turn": 7
    },
    {
      "participant_id": "spouse_B",
      "current_positions": [
        {
          "position_id": "pos-spouse_b-001",
          "issue_id": "parenting_schedule",
          "statement": "Party B (genuine concern, finally surfaced): Wants to be part of the children's ordinary daily life \u2014 not just weekend or special occasion time. Alternating weekends may not provide this. [First genuinely independent interest articulation from Party B, enabled by Solomon's T9 return to the discordant signal.]",
          "status": "current",
          "confidence": "high",
          "source_turns": [
            10
          ]
        }
      ],
      "proposals": [],
      "red_lines": [],
      "soft_preferences": [],
      "open_to_discussion": [],
      "last_updated_turn": 10
    }
  ],
  "position_notes": "The session ended with distinct starting positions preserved and no supported option movement yet."
}
