{
  "schema_version": "positions.v0",
  "case_id": "D-B04",
  "session_id": "D-B04-S01",
  "participants": [
    {
      "participant_id": "spouse_A",
      "current_positions": [
        {
          "position_id": "pos-a-001",
          "issue_id": "parenting_schedule",
          "statement": "School-night overnights should remain limited until transportation and homework routines are reliable.",
          "status": "current",
          "confidence": "high",
          "source_turns": [2]
        }
      ],
      "proposals": [
        {
          "proposal_id": "prop-a-001",
          "issue_id": "parenting_schedule",
          "statement": "A phased trial could be discussed if reliability conditions are explicit and school-week disruption is minimized.",
          "status": "tentative",
          "source_turns": [6, 8]
        }
      ],
      "red_lines": [
        "No week-to-week school-night changes without predictable notice.",
        "No expansion that ignores unresolved commute and homework-routine concerns."
      ],
      "soft_preferences": [
        "A stepwise approach rather than an immediate large change."
      ],
      "open_to_discussion": [
        "Conditional trial arrangements tied to reliability markers."
      ],
      "last_updated_turn": 8
    },
    {
      "participant_id": "spouse_B",
      "current_positions": [
        {
          "position_id": "pos-b-001",
          "issue_id": "parenting_schedule",
          "statement": "More school-week overnights are appropriate and logistics should be solved rather than used to block time.",
          "status": "current",
          "confidence": "high",
          "source_turns": [4]
        }
      ],
      "proposals": [
        {
          "proposal_id": "prop-b-001",
          "issue_id": "parenting_schedule",
          "statement": "A phased trial is acceptable if it clearly leads to meaningful school-week parenting time rather than indefinite delay.",
          "status": "tentative",
          "source_turns": [6, 8]
        }
      ],
      "red_lines": [
        "No arrangement that leaves Parent B in a visitor-level role.",
        "No unilateral control over future schedule changes by the other parent."
      ],
      "soft_preferences": [
        "A fairness-oriented structure that recognizes meaningful weekday parenting."
      ],
      "open_to_discussion": [
        "Contingent or phased options if they are tied to concrete logistics rather than vague reassurance."
      ],
      "last_updated_turn": 8
    }
  ],
  "position_notes": "The session ended with both parents still holding different starting positions but showing conditional openness to phased option work."
}
