{
  "schema_version": "positions.v0",
  "case_id": "D-B08",
  "session_id": "D-B08-S03",
  "participants": [
    {
      "participant_id": "spouse_A",
      "current_positions": [
        {
          "position_id": "pos-spouse_a-001",
          "issue_id": "communication_protocol",
          "statement": "The discussion needs to stay focused and stop circling because the same concerns keep getting repeated.",
          "status": "current",
          "confidence": "high",
          "source_turns": [
            2
          ]
        }
      ],
      "proposals": [],
      "red_lines": [],
      "soft_preferences": [],
      "open_to_discussion": [],
      "last_updated_turn": 2
    },
    {
      "participant_id": "spouse_B",
      "current_positions": [
        {
          "position_id": "pos-spouse_b-001",
          "issue_id": "fairness_and_parent_role",
          "statement": "The process no longer feels balanced enough to keep going productively without stronger intervention.",
          "status": "current",
          "confidence": "high",
          "source_turns": [
            4
          ]
        }
      ],
      "proposals": [],
      "red_lines": [],
      "soft_preferences": [],
      "open_to_discussion": [],
      "last_updated_turn": 4
    }
  ],
  "position_notes": "The session ended with distinct starting positions preserved and no supported option movement yet."
}
