{
  "schema_version": "positions.v0",
  "case_id": "D-B04",
  "session_id": "D-B04-S03",
  "participants": [
    {
      "participant_id": "spouse_A",
      "current_positions": [
        {
          "position_id": "pos-spouse_a-001",
          "issue_id": "parenting_schedule",
          "statement": "A predictable weekday structure should remain in place until logistics improve.",
          "status": "current",
          "confidence": "high",
          "source_turns": [
            2
          ]
        }
      ],
      "proposals": [
        {
          "proposal_id": "prop-spouse_a-001",
          "issue_id": "parenting_schedule",
          "statement": "A phased trial could be discussed if reliability conditions are explicit and school-week disruption is minimized.",
          "status": "tentative",
          "source_turns": [
            6
          ]
        },
        {
          "proposal_id": "prop-shared-001",
          "issue_id": "parenting_schedule",
          "statement": "Both parents remain open to phased exploration if reliability markers are explicit.",
          "status": "tentative",
          "source_turns": [
            8
          ]
        }
      ],
      "red_lines": [],
      "soft_preferences": [],
      "open_to_discussion": [],
      "last_updated_turn": 8
    },
    {
      "participant_id": "spouse_B",
      "current_positions": [
        {
          "position_id": "pos-spouse_b-001",
          "issue_id": "parenting_schedule",
          "statement": "More school-week overnights should be considered and a visitor-level role is not acceptable.",
          "status": "current",
          "confidence": "high",
          "source_turns": [
            4
          ]
        }
      ],
      "proposals": [
        {
          "proposal_id": "prop-spouse_b-001",
          "issue_id": "parenting_schedule",
          "statement": "A phased trial is acceptable if it clearly leads to meaningful school-week parenting time rather than indefinite delay.",
          "status": "tentative",
          "source_turns": [
            6
          ]
        },
        {
          "proposal_id": "prop-shared-001",
          "issue_id": "parenting_schedule",
          "statement": "Both parents remain open to phased exploration if reliability markers are explicit.",
          "status": "tentative",
          "source_turns": [
            8
          ]
        }
      ],
      "red_lines": [],
      "soft_preferences": [],
      "open_to_discussion": [],
      "last_updated_turn": 8
    }
  ],
  "position_notes": "The session ended with distinct starting positions preserved and at least one bounded proposal or package still open for further discussion."
}
